11:50:41.640659 ?     P   IP 10.10.1.6.44533 > 10.96.0.10.domain: 20020+ A? google.com. (28)
11:50:41.640672 ?     Out IP 10.10.1.6.44533 > 10.10.1.3.domain: 20020+ A? google.com. (28)
11:50:41.640681 ?     P   IP 10.10.1.6.44533 > 10.96.0.10.domain: 20439+ AAAA? google.com. (28)
11:50:41.640683 ?     Out IP 10.10.1.6.44533 > 10.10.1.3.domain: 20439+ AAAA? google.com. (28)
11:50:43.142003 ?     P   IP 10.10.1.3.domain > 10.10.1.6.44533: 20020 ServFail- 0/0/0 (28)
11:50:43.142008 ?     Out IP 10.96.0.10.domain > 10.10.1.6.44533: 20020 ServFail- 0/0/0 (28)
11:50:43.142033 ?     P   IP 10.10.1.3.domain > 10.10.1.6.44533: 20439 ServFail- 0/0/0 (28)
11:50:43.142033 ?     P   IP 10.10.1.6.44533 > 10.96.0.10.domain: 20020+ A? google.com. (28)
11:50:43.142038 ?     Out IP 10.96.0.10.domain > 10.10.1.6.44533: 20439 ServFail- 0/0/0 (28)
11:50:43.142042 ?     Out IP 10.10.1.6.44533 > 10.10.1.3.domain: 20020+ A? google.com. (28)
11:50:43.142048 ?     P   IP 10.10.1.6.44533 > 10.96.0.10.domain: 20439+ AAAA? google.com. (28)
11:50:43.142049 ?     Out IP 10.10.1.6.44533 > 10.10.1.3.domain: 20439+ AAAA? google.com. (28)
11:50:43.641738 ?     P   IP 10.10.1.3.domain > 10.10.1.6.44533: 20439 ServFail- 0/0/0 (28)
11:50:43.641751 ?     Out IP 10.96.0.10.domain > 10.10.1.6.44533: 20439 ServFail- 0/0/0 (28)
11:50:43.641765 ?     P   IP 10.10.1.3.domain > 10.10.1.6.44533: 20020 ServFail- 0/0/0 (28)
11:50:43.641766 ?     Out IP 10.96.0.10.domain > 10.10.1.6.44533: 20020 ServFail- 0/0/0 (28)
11:50:43.641880 ?     P   IP 10.10.1.6.44533 > 10.96.0.10.domain: 20439+ AAAA? google.com. (28)
11:50:43.641891 ?     Out IP 10.10.1.6.44533 > 10.10.1.3.domain: 20439+ AAAA? google.com. (28)
11:50:43.641900 ?     P   IP 10.10.1.6.44533 > 10.96.0.10.domain: 20020+ A? google.com. (28)
11:50:43.641901 ?     Out IP 10.10.1.6.44533 > 10.10.1.3.domain: 20020+ A? google.com. (28)
11:50:45.142665 ?     P   IP 10.10.1.3.domain > 10.10.1.6.44533: 20439 ServFail- 0/0/0 (28)
11:50:45.142679 ?     Out IP 10.96.0.10.domain > 10.10.1.6.44533: 20439 ServFail- 0/0/0 (28)
11:50:45.142692 ?     P   IP 10.10.1.6 > 10.96.0.10: ICMP 10.10.1.6 udp port 44533 unreachable, length 64
11:50:45.142700 br-5579defd698e In  IP 10.10.1.6 > 10.96.0.10: ICMP 10.10.1.6 udp port 44533 unreachable, length 64
11:50:45.142749 ?     P   IP 10.10.1.3.domain > 10.10.1.6.44533: 20020 ServFail- 0/0/0 (28)
11:50:45.142755 ?     Out IP 10.96.0.10.domain > 10.10.1.6.44533: 20020 ServFail- 0/0/0 (28)
11:50:45.142762 ?     P   IP 10.10.1.6 > 10.96.0.10: ICMP 10.10.1.6 udp port 44533 unreachable, length 64
11:50:45.142767 br-5579defd698e In  IP 10.10.1.6 > 10.96.0.10: ICMP 10.10.1.6 udp port 44533 unreachable, length 64
11:50:45.642177 ?     P   IP 10.10.1.3.domain > 10.10.1.6.44533: 20020 ServFail- 0/0/0 (28)
11:50:45.642186 ?     Out IP 10.96.0.10.domain > 10.10.1.6.44533: 20020 ServFail- 0/0/0 (28)
11:50:45.642202 ?     P   IP 10.10.1.6 > 10.96.0.10: ICMP 10.10.1.6 udp port 44533 unreachable, length 64
11:50:45.642214 br-5579defd698e In  IP 10.10.1.6 > 10.96.0.10: ICMP 10.10.1.6 udp port 44533 unreachable, length 64
11:50:45.642233 ?     P   IP 10.10.1.3.domain > 10.10.1.6.44533: 20439 ServFail- 0/0/0 (28)
11:50:45.642235 ?     Out IP 10.96.0.10.domain > 10.10.1.6.44533: 20439 ServFail- 0/0/0 (28)
11:50:45.642240 ?     P   IP 10.10.1.6 > 10.96.0.10: ICMP 10.10.1.6 udp port 44533 unreachable, length 64
11:50:45.642241 br-5579defd698e In  IP 10.10.1.6 > 10.96.0.10: ICMP 10.10.1.6 udp port 44533 unreachable, length 64
11:50:46.142871 ?     P   IP 10.10.1.6.38857 > 10.96.0.10.domain: 52172+ A? google.com.kube-system.svc.cluster.local. (58)
11:50:46.142896 ?     P   IP 10.10.1.6.38857 > 10.96.0.10.domain: 52354+ AAAA? google.com.kube-system.svc.cluster.local. (58)
11:50:46.143094 ?     Out IP 10.10.1.6.38857 > 10.10.1.2.domain: 52172+ A? google.com.kube-system.svc.cluster.local. (58)
11:50:46.143106 ?     Out IP 10.10.1.6.38857 > 10.10.1.2.domain: 52354+ AAAA? google.com.kube-system.svc.cluster.local. (58)
11:50:46.143321 ?     P   IP 10.10.1.2.domain > 10.10.1.6.38857: 52354 NXDomain*- 0/1/0 (151)
11:50:46.143329 ?     Out IP 10.96.0.10.domain > 10.10.1.6.38857: 52354 NXDomain*- 0/1/0 (151)
11:50:46.143358 ?     P   IP 10.10.1.2.domain > 10.10.1.6.38857: 52172 NXDomain*- 0/1/0 (151)
11:50:46.143365 ?     Out IP 10.96.0.10.domain > 10.10.1.6.38857: 52172 NXDomain*- 0/1/0 (151)
11:50:46.143401 ?     P   IP 10.10.1.6.36489 > 10.96.0.10.domain: 58310+ A? google.com.svc.cluster.local. (46)
11:50:46.143421 ?     P   IP 10.10.1.6.36489 > 10.96.0.10.domain: 58510+ AAAA? google.com.svc.cluster.local. (46)
11:50:46.143557 ?     Out IP 10.10.1.6.36489 > 10.10.1.2.domain: 58310+ A? google.com.svc.cluster.local. (46)
11:50:46.143569 ?     Out IP 10.10.1.6.36489 > 10.10.1.2.domain: 58510+ AAAA? google.com.svc.cluster.local. (46)
11:50:46.143678 ?     P   IP 10.10.1.2.domain > 10.10.1.6.36489: 58510 NXDomain*- 0/1/0 (139)
11:50:46.143684 ?     Out IP 10.96.0.10.domain > 10.10.1.6.36489: 58510 NXDomain*- 0/1/0 (139)
11:50:46.143721 ?     P   IP 10.10.1.2.domain > 10.10.1.6.36489: 58310 NXDomain*- 0/1/0 (139)
11:50:46.143727 ?     Out IP 10.96.0.10.domain > 10.10.1.6.36489: 58310 NXDomain*- 0/1/0 (139)
11:50:46.143751 ?     P   IP 10.10.1.6.33682 > 10.96.0.10.domain: 21166+ A? google.com.cluster.local. (42)
11:50:46.143767 ?     P   IP 10.10.1.6.33682 > 10.96.0.10.domain: 21333+ AAAA? google.com.cluster.local. (42)
11:50:46.143864 ?     Out IP 10.10.1.6.33682 > 10.10.1.3.domain: 21166+ A? google.com.cluster.local. (42)
11:50:46.143876 ?     Out IP 10.10.1.6.33682 > 10.10.1.3.domain: 21333+ AAAA? google.com.cluster.local. (42)
11:50:46.144012 ?     P   IP 10.10.1.3.domain > 10.10.1.6.33682: 21166 NXDomain*- 0/1/0 (135)
11:50:46.144017 ?     Out IP 10.96.0.10.domain > 10.10.1.6.33682: 21166 NXDomain*- 0/1/0 (135)
11:50:46.144035 ?     P   IP 10.10.1.3.domain > 10.10.1.6.33682: 21333 NXDomain*- 0/1/0 (135)
11:50:46.144038 ?     Out IP 10.96.0.10.domain > 10.10.1.6.33682: 21333 NXDomain*- 0/1/0 (135)
11:50:46.144053 ?     P   IP 10.10.1.6.isnetserv > 10.96.0.10.domain: 772+ A? google.com. (28)
11:50:46.144065 ?     P   IP 10.10.1.6.isnetserv > 10.96.0.10.domain: 1145+ AAAA? google.com. (28)
11:50:46.144167 ?     Out IP 10.10.1.6.isnetserv > 10.10.1.2.domain: 772+ A? google.com. (28)
11:50:46.144178 ?     Out IP 10.10.1.6.isnetserv > 10.10.1.2.domain: 1145+ AAAA? google.com. (28)
11:50:48.154419 ?     P   IP 10.10.1.2.domain > 10.10.1.6.isnetserv: 772 1/0/0 A 142.251.221.206 (54)
11:50:48.154427 ?     Out IP 10.96.0.10.domain > 10.10.1.6.isnetserv: 772 1/0/0 A 142.251.221.206 (54)
11:50:48.154498 ?     P   IP 10.10.1.2.domain > 10.10.1.6.isnetserv: 1145 1/0/0 AAAA 2404:6800:4007:837::200e (66)
11:50:48.154506 ?     Out IP 10.96.0.10.domain > 10.10.1.6.isnetserv: 1145 1/0/0 AAAA 2404:6800:4007:837::200e (66)
11:50:48.154683 ?     P   IP 10.10.1.6 > pnmaaa-ba-in-f14.1e100.net: ICMP echo request, id 1264, seq 0, length 64
11:50:48.154900 br-5579defd698e In  IP 10.10.1.6 > pnmaaa-ba-in-f14.1e100.net: ICMP echo request, id 1264, seq 0, length 64
11:50:48.217142 br-5579defd698e Out IP pnmaaa-ba-in-f14.1e100.net > 10.10.1.6: ICMP echo reply, id 1264, seq 0, length 64
11:50:48.217264 ?     Out IP pnmaaa-ba-in-f14.1e100.net > 10.10.1.6: ICMP echo reply, id 1264, seq 0, length 64
11:50:48.506768 ?     P   ARP, Request who-has 10.10.1.6 tell 10.10.1.3, length 28
11:50:48.506962 ?     Out ARP, Request who-has 10.10.1.6 tell 10.10.1.3, length 28
11:50:48.506970 ?     P   ARP, Reply 10.10.1.6 is-at d6:27:0c:35:b1:16 (oui Unknown), length 28
11:50:48.507055 ?     Out ARP, Reply 10.10.1.6 is-at d6:27:0c:35:b1:16 (oui Unknown), length 28
11:50:50.218804 ?     P   IP 10.10.1.6.59187 > 10.96.0.10.domain: 15437+ A? google.com.kube-system.svc.cluster.local. (58)
11:50:50.218840 ?     P   IP 10.10.1.6.59187 > 10.96.0.10.domain: 15733+ AAAA? google.com.kube-system.svc.cluster.local. (58)
11:50:50.218977 ?     Out IP 10.10.1.6.59187 > 10.10.1.2.domain: 15437+ A? google.com.kube-system.svc.cluster.local. (58)
11:50:50.218996 ?     Out IP 10.10.1.6.59187 > 10.10.1.2.domain: 15733+ AAAA? google.com.kube-system.svc.cluster.local. (58)
11:50:50.219140 ?     P   IP 10.10.1.2.domain > 10.10.1.6.59187: 15733 NXDomain*- 0/1/0 (151)
11:50:50.219148 ?     Out IP 10.96.0.10.domain > 10.10.1.6.59187: 15733 NXDomain*- 0/1/0 (151)
11:50:50.219178 ?     P   IP 10.10.1.2.domain > 10.10.1.6.59187: 15437 NXDomain*- 0/1/0 (151)
11:50:50.219181 ?     Out IP 10.96.0.10.domain > 10.10.1.6.59187: 15437 NXDomain*- 0/1/0 (151)
11:50:50.219212 ?     P   IP 10.10.1.6.54923 > 10.96.0.10.domain: 49833+ A? google.com.svc.cluster.local. (46)
11:50:50.219229 ?     P   IP 10.10.1.6.54923 > 10.96.0.10.domain: 50061+ AAAA? google.com.svc.cluster.local. (46)
11:50:50.219298 ?     Out IP 10.10.1.6.54923 > 10.10.1.3.domain: 49833+ A? google.com.svc.cluster.local. (46)
11:50:50.219311 ?     Out IP 10.10.1.6.54923 > 10.10.1.3.domain: 50061+ AAAA? google.com.svc.cluster.local. (46)
11:50:50.219402 ?     P   IP 10.10.1.3.domain > 10.10.1.6.54923: 49833 NXDomain*- 0/1/0 (139)
11:50:50.219408 ?     Out IP 10.96.0.10.domain > 10.10.1.6.54923: 49833 NXDomain*- 0/1/0 (139)
11:50:50.219428 ?     P   IP 10.10.1.3.domain > 10.10.1.6.54923: 50061 NXDomain*- 0/1/0 (139)
11:50:50.219430 ?     Out IP 10.96.0.10.domain > 10.10.1.6.54923: 50061 NXDomain*- 0/1/0 (139)
11:50:50.219448 ?     P   IP 10.10.1.6.54683 > 10.96.0.10.domain: 28436+ A? google.com.cluster.local. (42)
11:50:50.219459 ?     P   IP 10.10.1.6.54683 > 10.96.0.10.domain: 28830+ AAAA? google.com.cluster.local. (42)
11:50:50.219520 ?     Out IP 10.10.1.6.54683 > 10.10.1.2.domain: 28436+ A? google.com.cluster.local. (42)
11:50:50.219530 ?     Out IP 10.10.1.6.54683 > 10.10.1.2.domain: 28830+ AAAA? google.com.cluster.local. (42)
11:50:50.219597 ?     P   IP 10.10.1.2.domain > 10.10.1.6.54683: 28830 NXDomain*- 0/1/0 (135)
11:50:50.219604 ?     Out IP 10.96.0.10.domain > 10.10.1.6.54683: 28830 NXDomain*- 0/1/0 (135)
11:50:50.219660 ?     P   IP 10.10.1.2.domain > 10.10.1.6.54683: 28436 NXDomain*- 0/1/0 (135)
11:50:50.219666 ?     Out IP 10.96.0.10.domain > 10.10.1.6.54683: 28436 NXDomain*- 0/1/0 (135)
11:50:50.219753 ?     P   IP 10.10.1.6.35670 > 10.96.0.10.domain: 62542+ A? google.com. (28)
11:50:50.219765 ?     Out IP 10.10.1.6.35670 > 10.10.1.2.domain: 62542+ A? google.com. (28)
11:50:50.219772 ?     P   IP 10.10.1.6.35670 > 10.96.0.10.domain: 62928+ AAAA? google.com. (28)
11:50:50.219812 ?     P   IP 10.10.1.2.domain > 10.10.1.6.35670: 62542* 1/0/0 A 142.251.221.206 (54)
11:50:50.219816 ?     Out IP 10.96.0.10.domain > 10.10.1.6.35670: 62542* 1/0/0 A 142.251.221.206 (54)
11:50:50.219911 ?     Out IP 10.10.1.6.35670 > 10.10.1.2.domain: 62928+ AAAA? google.com. (28)
11:50:50.220027 ?     P   IP 10.10.1.2.domain > 10.10.1.6.35670: 62928* 1/0/0 AAAA 2404:6800:4007:837::200e (66)
11:50:50.220033 ?     Out IP 10.96.0.10.domain > 10.10.1.6.35670: 62928* 1/0/0 AAAA 2404:6800:4007:837::200e (66)
11:50:50.220116 ?     P   IP 10.10.1.6 > pnmaaa-ba-in-f14.1e100.net: ICMP echo request, id 1266, seq 0, length 64
11:50:50.220131 br-5579defd698e In  IP 10.10.1.6 > pnmaaa-ba-in-f14.1e100.net: ICMP echo request, id 1266, seq 0, length 64
11:50:50.280345 br-5579defd698e Out IP pnmaaa-ba-in-f14.1e100.net > 10.10.1.6: ICMP echo reply, id 1266, seq 0, length 64
11:50:50.280358 ?     Out IP pnmaaa-ba-in-f14.1e100.net > 10.10.1.6: ICMP echo reply, id 1266, seq 0, length 64
11:50:52.281799 ?     P   IP 10.10.1.6.47194 > 10.96.0.10.domain: 34017+ A? google.com.kube-system.svc.cluster.local. (58)
11:50:52.281826 ?     Out IP 10.10.1.6.47194 > 10.10.1.3.domain: 34017+ A? google.com.kube-system.svc.cluster.local. (58)
11:50:52.281840 ?     P   IP 10.10.1.6.47194 > 10.96.0.10.domain: 34270+ AAAA? google.com.kube-system.svc.cluster.local. (58)
11:50:52.281986 ?     P   IP 10.10.1.3.domain > 10.10.1.6.47194: 34017 NXDomain*- 0/1/0 (151)
11:50:52.281994 ?     Out IP 10.96.0.10.domain > 10.10.1.6.47194: 34017 NXDomain*- 0/1/0 (151)
11:50:52.282017 ?     Out IP 10.10.1.6.47194 > 10.10.1.3.domain: 34270+ AAAA? google.com.kube-system.svc.cluster.local. (58)
11:50:52.282100 ?     P   IP 10.10.1.3.domain > 10.10.1.6.47194: 34270 NXDomain*- 0/1/0 (151)
11:50:52.282106 ?     Out IP 10.96.0.10.domain > 10.10.1.6.47194: 34270 NXDomain*- 0/1/0 (151)
11:50:52.282175 ?     P   IP 10.10.1.6.41457 > 10.96.0.10.domain: 32674+ A? google.com.svc.cluster.local. (46)
11:50:52.282189 ?     Out IP 10.10.1.6.41457 > 10.10.1.3.domain: 32674+ A? google.com.svc.cluster.local. (46)
11:50:52.282196 ?     P   IP 10.10.1.6.41457 > 10.96.0.10.domain: 32864+ AAAA? google.com.svc.cluster.local. (46)
11:50:52.282200 ?     Out IP 10.10.1.6.41457 > 10.10.1.3.domain: 32864+ AAAA? google.com.svc.cluster.local. (46)
11:50:52.282256 ?     P   IP 10.10.1.3.domain > 10.10.1.6.41457: 32864 NXDomain*- 0/1/0 (139)
11:50:52.282260 ?     Out IP 10.96.0.10.domain > 10.10.1.6.41457: 32864 NXDomain*- 0/1/0 (139)
11:50:52.282274 ?     P   IP 10.10.1.3.domain > 10.10.1.6.41457: 32674 NXDomain*- 0/1/0 (139)
11:50:52.282276 ?     Out IP 10.96.0.10.domain > 10.10.1.6.41457: 32674 NXDomain*- 0/1/0 (139)
11:50:52.282291 ?     P   IP 10.10.1.6.36014 > 10.96.0.10.domain: 25722+ A? google.com.cluster.local. (42)
11:50:52.282301 ?     Out IP 10.10.1.6.36014 > 10.10.1.2.domain: 25722+ A? google.com.cluster.local. (42)
11:50:52.282310 ?     P   IP 10.10.1.6.36014 > 10.96.0.10.domain: 26076+ AAAA? google.com.cluster.local. (42)
11:50:52.282313 ?     Out IP 10.10.1.6.36014 > 10.10.1.2.domain: 26076+ AAAA? google.com.cluster.local. (42)
11:50:52.282383 ?     P   IP 10.10.1.2.domain > 10.10.1.6.36014: 26076 NXDomain*- 0/1/0 (135)
11:50:52.282387 ?     Out IP 10.96.0.10.domain > 10.10.1.6.36014: 26076 NXDomain*- 0/1/0 (135)
11:50:52.282445 ?     P   IP 10.10.1.2.domain > 10.10.1.6.36014: 25722 NXDomain*- 0/1/0 (135)
11:50:52.282454 ?     Out IP 10.96.0.10.domain > 10.10.1.6.36014: 25722 NXDomain*- 0/1/0 (135)
11:50:52.282491 ?     P   IP 10.10.1.6.idmgratm > 10.96.0.10.domain: 22951+ A? google.com. (28)
11:50:52.282506 ?     P   IP 10.10.1.6.idmgratm > 10.96.0.10.domain: 23116+ AAAA? google.com. (28)
11:50:52.282764 ?     Out IP 10.10.1.6.idmgratm > 10.10.1.2.domain: 22951+ A? google.com. (28)
11:50:52.282771 ?     Out IP 10.10.1.6.idmgratm > 10.10.1.2.domain: 23116+ AAAA? google.com. (28)
11:50:52.282822 ?     P   IP 10.10.1.2.domain > 10.10.1.6.idmgratm: 22951* 1/0/0 A 142.251.221.206 (54)
11:50:52.282827 ?     Out IP 10.96.0.10.domain > 10.10.1.6.idmgratm: 22951* 1/0/0 A 142.251.221.206 (54)
11:50:52.282841 ?     P   IP 10.10.1.2.domain > 10.10.1.6.idmgratm: 23116* 1/0/0 AAAA 2404:6800:4007:837::200e (66)
11:50:52.282843 ?     Out IP 10.96.0.10.domain > 10.10.1.6.idmgratm: 23116* 1/0/0 AAAA 2404:6800:4007:837::200e (66)
11:50:52.282914 ?     P   IP 10.10.1.6 > pnmaaa-ba-in-f14.1e100.net: ICMP echo request, id 1268, seq 0, length 64
11:50:52.282927 br-5579defd698e In  IP 10.10.1.6 > pnmaaa-ba-in-f14.1e100.net: ICMP echo request, id 1268, seq 0, length 64
11:50:52.346264 br-5579defd698e Out IP pnmaaa-ba-in-f14.1e100.net > 10.10.1.6: ICMP echo reply, id 1268, seq 0, length 64
11:50:52.346276 ?     Out IP pnmaaa-ba-in-f14.1e100.net > 10.10.1.6: ICMP echo reply, id 1268, seq 0, length 64
11:50:54.348160 ?     P   IP 10.10.1.6.47781 > 10.96.0.10.domain: 59411+ A? google.com.kube-system.svc.cluster.local. (58)
11:50:54.348192 ?     Out IP 10.10.1.6.47781 > 10.10.1.2.domain: 59411+ A? google.com.kube-system.svc.cluster.local. (58)
11:50:54.348211 ?     P   IP 10.10.1.6.47781 > 10.96.0.10.domain: 59713+ AAAA? google.com.kube-system.svc.cluster.local. (58)
11:50:54.348216 ?     Out IP 10.10.1.6.47781 > 10.10.1.2.domain: 59713+ AAAA? google.com.kube-system.svc.cluster.local. (58)
11:50:54.348382 ?     P   IP 10.10.1.2.domain > 10.10.1.6.47781: 59713 NXDomain*- 0/1/0 (151)
11:50:54.348390 ?     Out IP 10.96.0.10.domain > 10.10.1.6.47781: 59713 NXDomain*- 0/1/0 (151)
11:50:54.348421 ?     P   IP 10.10.1.2.domain > 10.10.1.6.47781: 59411 NXDomain*- 0/1/0 (151)
11:50:54.348423 ?     Out IP 10.96.0.10.domain > 10.10.1.6.47781: 59411 NXDomain*- 0/1/0 (151)
11:50:54.348446 ?     P   IP 10.10.1.6.45728 > 10.96.0.10.domain: 53227+ A? google.com.svc.cluster.local. (46)
11:50:54.348466 ?     P   IP 10.10.1.6.45728 > 10.96.0.10.domain: 53408+ AAAA? google.com.svc.cluster.local. (46)
11:50:54.348679 ?     Out IP 10.10.1.6.45728 > 10.10.1.3.domain: 53227+ A? google.com.svc.cluster.local. (46)
11:50:54.348694 ?     Out IP 10.10.1.6.45728 > 10.10.1.3.domain: 53408+ AAAA? google.com.svc.cluster.local. (46)
11:50:54.348864 ?     P   IP 10.10.1.3.domain > 10.10.1.6.45728: 53408 NXDomain*- 0/1/0 (139)
11:50:54.348872 ?     Out IP 10.96.0.10.domain > 10.10.1.6.45728: 53408 NXDomain*- 0/1/0 (139)
11:50:54.348898 ?     P   IP 10.10.1.3.domain > 10.10.1.6.45728: 53227 NXDomain*- 0/1/0 (139)
11:50:54.348901 ?     Out IP 10.96.0.10.domain > 10.10.1.6.45728: 53227 NXDomain*- 0/1/0 (139)
11:50:54.348927 ?     P   IP 10.10.1.6.56769 > 10.96.0.10.domain: 5550+ A? google.com.cluster.local. (42)
11:50:54.348940 ?     Out IP 10.10.1.6.56769 > 10.10.1.2.domain: 5550+ A? google.com.cluster.local. (42)
11:50:54.348949 ?     P   IP 10.10.1.6.56769 > 10.96.0.10.domain: 5761+ AAAA? google.com.cluster.local. (42)
11:50:54.348953 ?     Out IP 10.10.1.6.56769 > 10.10.1.2.domain: 5761+ AAAA? google.com.cluster.local. (42)
11:50:54.349060 ?     P   IP 10.10.1.2.domain > 10.10.1.6.56769: 5761 NXDomain*- 0/1/0 (135)
11:50:54.349067 ?     Out IP 10.96.0.10.domain > 10.10.1.6.56769: 5761 NXDomain*- 0/1/0 (135)
11:50:54.349089 ?     P   IP 10.10.1.2.domain > 10.10.1.6.56769: 5550 NXDomain*- 0/1/0 (135)
11:50:54.349095 ?     Out IP 10.96.0.10.domain > 10.10.1.6.56769: 5550 NXDomain*- 0/1/0 (135)
11:50:54.349125 ?     P   IP 10.10.1.6.37931 > 10.96.0.10.domain: 5240+ A? google.com. (28)
11:50:54.349139 ?     Out IP 10.10.1.6.37931 > 10.10.1.2.domain: 5240+ A? google.com. (28)
11:50:54.349147 ?     P   IP 10.10.1.6.37931 > 10.96.0.10.domain: 5382+ AAAA? google.com. (28)
11:50:54.349151 ?     Out IP 10.10.1.6.37931 > 10.10.1.2.domain: 5382+ AAAA? google.com. (28)
11:50:54.349226 ?     P   IP 10.10.1.2.domain > 10.10.1.6.37931: 5382* 1/0/0 AAAA 2404:6800:4007:837::200e (66)
11:50:54.349232 ?     Out IP 10.96.0.10.domain > 10.10.1.6.37931: 5382* 1/0/0 AAAA 2404:6800:4007:837::200e (66)
11:50:54.349260 ?     P   IP 10.10.1.2.domain > 10.10.1.6.37931: 5240* 1/0/0 A 142.251.221.206 (54)
11:50:54.349265 ?     Out IP 10.96.0.10.domain > 10.10.1.6.37931: 5240* 1/0/0 A 142.251.221.206 (54)
11:50:54.349331 ?     P   IP 10.10.1.6 > pnmaaa-ba-in-f14.1e100.net: ICMP echo request, id 1270, seq 0, length 64
11:50:54.349344 br-5579defd698e In  IP 10.10.1.6 > pnmaaa-ba-in-f14.1e100.net: ICMP echo request, id 1270, seq 0, length 64
11:50:54.413314 br-5579defd698e Out IP pnmaaa-ba-in-f14.1e100.net > 10.10.1.6: ICMP echo reply, id 1270, seq 0, length 64
11:50:54.413322 ?     Out IP pnmaaa-ba-in-f14.1e100.net > 10.10.1.6: ICMP echo reply, id 1270, seq 0, length 64
11:50:55.675648 br-5579defd698e Out ARP, Request who-has 10.10.1.6 tell 10.10.1.1, length 28
11:50:55.675847 ?     Out ARP, Request who-has 10.10.1.6 tell 10.10.1.1, length 28
11:50:55.675856 ?     P   ARP, Reply 10.10.1.6 is-at d6:27:0c:35:b1:16 (oui Unknown), length 28
11:50:55.676027 br-5579defd698e In  ARP, Reply 10.10.1.6 is-at d6:27:0c:35:b1:16 (oui Unknown), length 28
11:50:56.414973 ?     P   IP 10.10.1.6.41135 > 10.96.0.10.domain: 42699+ A? google.com.kube-system.svc.cluster.local. (58)
11:50:56.415003 ?     P   IP 10.10.1.6.41135 > 10.96.0.10.domain: 42983+ AAAA? google.com.kube-system.svc.cluster.local. (58)
11:50:56.415131 ?     Out IP 10.10.1.6.41135 > 10.10.1.3.domain: 42699+ A? google.com.kube-system.svc.cluster.local. (58)
11:50:56.415147 ?     Out IP 10.10.1.6.41135 > 10.10.1.3.domain: 42983+ AAAA? google.com.kube-system.svc.cluster.local. (58)
11:50:56.415319 ?     P   IP 10.10.1.3.domain > 10.10.1.6.41135: 42983 NXDomain*- 0/1/0 (151)
11:50:56.415327 ?     Out IP 10.96.0.10.domain > 10.10.1.6.41135: 42983 NXDomain*- 0/1/0 (151)
11:50:56.415353 ?     P   IP 10.10.1.3.domain > 10.10.1.6.41135: 42699 NXDomain*- 0/1/0 (151)
11:50:56.415355 ?     Out IP 10.96.0.10.domain > 10.10.1.6.41135: 42699 NXDomain*- 0/1/0 (151)
11:50:56.415419 ?     P   IP 10.10.1.6.32828 > 10.96.0.10.domain: 34339+ A? google.com.svc.cluster.local. (46)
11:50:56.415432 ?     Out IP 10.10.1.6.32828 > 10.10.1.2.domain: 34339+ A? google.com.svc.cluster.local. (46)
11:50:56.415443 ?     P   IP 10.10.1.6.32828 > 10.96.0.10.domain: 34758+ AAAA? google.com.svc.cluster.local. (46)
11:50:56.415447 ?     Out IP 10.10.1.6.32828 > 10.10.1.2.domain: 34758+ AAAA? google.com.svc.cluster.local. (46)
11:50:56.415599 ?     P   IP 10.10.1.2.domain > 10.10.1.6.32828: 34758 NXDomain*- 0/1/0 (139)
11:50:56.415609 ?     Out IP 10.96.0.10.domain > 10.10.1.6.32828: 34758 NXDomain*- 0/1/0 (139)
11:50:56.415647 ?     P   IP 10.10.1.2.domain > 10.10.1.6.32828: 34339 NXDomain*- 0/1/0 (139)
11:50:56.415649 ?     Out IP 10.96.0.10.domain > 10.10.1.6.32828: 34339 NXDomain*- 0/1/0 (139)
11:50:56.415763 ?     P   IP 10.10.1.6.54146 > 10.96.0.10.domain: 58501+ A? google.com.cluster.local. (42)
11:50:56.415776 ?     Out IP 10.10.1.6.54146 > 10.10.1.2.domain: 58501+ A? google.com.cluster.local. (42)
11:50:56.415783 ?     P   IP 10.10.1.6.54146 > 10.96.0.10.domain: 58879+ AAAA? google.com.cluster.local. (42)
11:50:56.415785 ?     Out IP 10.10.1.6.54146 > 10.10.1.2.domain: 58879+ AAAA? google.com.cluster.local. (42)
11:50:56.415869 ?     P   IP 10.10.1.2.domain > 10.10.1.6.54146: 58879 NXDomain*- 0/1/0 (135)
11:50:56.415875 ?     Out IP 10.96.0.10.domain > 10.10.1.6.54146: 58879 NXDomain*- 0/1/0 (135)
11:50:56.415939 ?     P   IP 10.10.1.2.domain > 10.10.1.6.54146: 58501 NXDomain*- 0/1/0 (135)
11:50:56.415948 ?     Out IP 10.96.0.10.domain > 10.10.1.6.54146: 58501 NXDomain*- 0/1/0 (135)
11:50:56.416029 ?     P   IP 10.10.1.6.53335 > 10.96.0.10.domain: 64734+ A? google.com. (28)
11:50:56.416043 ?     Out IP 10.10.1.6.53335 > 10.10.1.3.domain: 64734+ A? google.com. (28)
11:50:56.416052 ?     P   IP 10.10.1.6.53335 > 10.96.0.10.domain: 64864+ AAAA? google.com. (28)
11:50:56.416056 ?     Out IP 10.10.1.6.53335 > 10.10.1.3.domain: 64864+ AAAA? google.com. (28)
11:50:56.423548 ?     P   IP 10.10.1.3.domain > 10.10.1.6.53335: 64734 1/0/0 A 142.251.221.206 (54)
11:50:56.423554 ?     Out IP 10.96.0.10.domain > 10.10.1.6.53335: 64734 1/0/0 A 142.251.221.206 (54)
11:50:56.423597 ?     P   IP 10.10.1.3.domain > 10.10.1.6.53335: 64864 1/0/0 AAAA 2404:6800:4007:837::200e (66)
11:50:56.423602 ?     Out IP 10.96.0.10.domain > 10.10.1.6.53335: 64864 1/0/0 AAAA 2404:6800:4007:837::200e (66)
11:50:56.423657 ?     P   IP 10.10.1.6 > pnmaaa-ba-in-f14.1e100.net: ICMP echo request, id 1272, seq 0, length 64
11:50:56.423667 br-5579defd698e In  IP 10.10.1.6 > pnmaaa-ba-in-f14.1e100.net: ICMP echo request, id 1272, seq 0, length 64
11:50:56.485337 br-5579defd698e Out IP pnmaaa-ba-in-f14.1e100.net > 10.10.1.6: ICMP echo reply, id 1272, seq 0, length 64
11:50:56.485346 ?     Out IP pnmaaa-ba-in-f14.1e100.net > 10.10.1.6: ICMP echo reply, id 1272, seq 0, length 64
11:50:58.486956 ?     P   IP 10.10.1.6.40095 > 10.96.0.10.domain: 4944+ A? google.com.kube-system.svc.cluster.local. (58)
11:50:58.486980 ?     Out IP 10.10.1.6.40095 > 10.10.1.3.domain: 4944+ A? google.com.kube-system.svc.cluster.local. (58)
11:50:58.486999 ?     P   IP 10.10.1.6.40095 > 10.96.0.10.domain: 5239+ AAAA? google.com.kube-system.svc.cluster.local. (58)
11:50:58.487004 ?     Out IP 10.10.1.6.40095 > 10.10.1.3.domain: 5239+ AAAA? google.com.kube-system.svc.cluster.local. (58)
11:50:58.487173 ?     P   IP 10.10.1.3.domain > 10.10.1.6.40095: 5239 NXDomain*- 0/1/0 (151)
11:50:58.487182 ?     Out IP 10.96.0.10.domain > 10.10.1.6.40095: 5239 NXDomain*- 0/1/0 (151)
11:50:58.487208 ?     P   IP 10.10.1.3.domain > 10.10.1.6.40095: 4944 NXDomain*- 0/1/0 (151)
11:50:58.487210 ?     Out IP 10.96.0.10.domain > 10.10.1.6.40095: 4944 NXDomain*- 0/1/0 (151)
11:50:58.487259 ?     P   IP 10.10.1.6.48082 > 10.96.0.10.domain: 56309+ A? google.com.svc.cluster.local. (46)
11:50:58.487279 ?     P   IP 10.10.1.6.48082 > 10.96.0.10.domain: 56478+ AAAA? google.com.svc.cluster.local. (46)
11:50:58.487458 ?     Out IP 10.10.1.6.48082 > 10.10.1.2.domain: 56309+ A? google.com.svc.cluster.local. (46)
11:50:58.487472 ?     Out IP 10.10.1.6.48082 > 10.10.1.2.domain: 56478+ AAAA? google.com.svc.cluster.local. (46)
11:50:58.487616 ?     P   IP 10.10.1.2.domain > 10.10.1.6.48082: 56478 NXDomain*- 0/1/0 (139)
11:50:58.487627 ?     Out IP 10.96.0.10.domain > 10.10.1.6.48082: 56478 NXDomain*- 0/1/0 (139)
11:50:58.487668 ?     P   IP 10.10.1.2.domain > 10.10.1.6.48082: 56309 NXDomain*- 0/1/0 (139)
11:50:58.487670 ?     Out IP 10.96.0.10.domain > 10.10.1.6.48082: 56309 NXDomain*- 0/1/0 (139)
11:50:58.487696 ?     P   IP 10.10.1.6.38372 > 10.96.0.10.domain: 35426+ A? google.com.cluster.local. (42)
11:50:58.487712 ?     P   IP 10.10.1.6.38372 > 10.96.0.10.domain: 35799+ AAAA? google.com.cluster.local. (42)
11:50:58.487771 ?     Out IP 10.10.1.6.38372 > 10.10.1.3.domain: 35426+ A? google.com.cluster.local. (42)
11:50:58.487776 ?     Out IP 10.10.1.6.38372 > 10.10.1.3.domain: 35799+ AAAA? google.com.cluster.local. (42)
11:50:58.487879 ?     P   IP 10.10.1.3.domain > 10.10.1.6.38372: 35799 NXDomain*- 0/1/0 (135)
11:50:58.487884 ?     Out IP 10.96.0.10.domain > 10.10.1.6.38372: 35799 NXDomain*- 0/1/0 (135)
11:50:58.487901 ?     P   IP 10.10.1.3.domain > 10.10.1.6.38372: 35426 NXDomain*- 0/1/0 (135)
11:50:58.487902 ?     Out IP 10.96.0.10.domain > 10.10.1.6.38372: 35426 NXDomain*- 0/1/0 (135)
11:50:58.487908 ?     P   IP 10.10.1.6.48113 > 10.96.0.10.domain: 63600+ A? google.com. (28)
11:50:58.487915 ?     Out IP 10.10.1.6.48113 > 10.10.1.3.domain: 63600+ A? google.com. (28)
11:50:58.487919 ?     P   IP 10.10.1.6.48113 > 10.96.0.10.domain: 63942+ AAAA? google.com. (28)
11:50:58.487921 ?     Out IP 10.10.1.6.48113 > 10.10.1.3.domain: 63942+ AAAA? google.com. (28)
11:50:58.487979 ?     P   IP 10.10.1.3.domain > 10.10.1.6.48113: 63942* 1/0/0 AAAA 2404:6800:4007:837::200e (66)
11:50:58.487985 ?     Out IP 10.96.0.10.domain > 10.10.1.6.48113: 63942* 1/0/0 AAAA 2404:6800:4007:837::200e (66)
11:50:58.488000 ?     P   IP 10.10.1.3.domain > 10.10.1.6.48113: 63600* 1/0/0 A 142.251.221.206 (54)
11:50:58.488001 ?     Out IP 10.96.0.10.domain > 10.10.1.6.48113: 63600* 1/0/0 A 142.251.221.206 (54)
11:50:58.488042 ?     P   IP 10.10.1.6 > pnmaaa-ba-in-f14.1e100.net: ICMP echo request, id 1274, seq 0, length 64
11:50:58.488046 br-5579defd698e In  IP 10.10.1.6 > pnmaaa-ba-in-f14.1e100.net: ICMP echo request, id 1274, seq 0, length 64
11:50:58.552179 br-5579defd698e Out IP pnmaaa-ba-in-f14.1e100.net > 10.10.1.6: ICMP echo reply, id 1274, seq 0, length 64
11:50:58.552186 ?     Out IP pnmaaa-ba-in-f14.1e100.net > 10.10.1.6: ICMP echo reply, id 1274, seq 0, length 64
11:51:00.553621 ?     P   IP 10.10.1.6.36471 > 10.96.0.10.domain: 15791+ A? google.com.kube-system.svc.cluster.local. (58)
11:51:00.553658 ?     Out IP 10.10.1.6.36471 > 10.10.1.2.domain: 15791+ A? google.com.kube-system.svc.cluster.local. (58)
11:51:00.553822 ?     P   IP 10.10.1.6.36471 > 10.96.0.10.domain: 16013+ AAAA? google.com.kube-system.svc.cluster.local. (58)
11:51:00.553827 ?     P   IP 10.10.1.2.domain > 10.10.1.6.36471: 15791 NXDomain*- 0/1/0 (151)
11:51:00.553834 ?     Out IP 10.96.0.10.domain > 10.10.1.6.36471: 15791 NXDomain*- 0/1/0 (151)
11:51:00.553837 ?     Out IP 10.10.1.6.36471 > 10.10.1.2.domain: 16013+ AAAA? google.com.kube-system.svc.cluster.local. (58)
11:51:00.553916 ?     P   IP 10.10.1.2.domain > 10.10.1.6.36471: 16013 NXDomain*- 0/1/0 (151)
11:51:00.553922 ?     Out IP 10.96.0.10.domain > 10.10.1.6.36471: 16013 NXDomain*- 0/1/0 (151)
11:51:00.553991 ?     P   IP 10.10.1.6.56902 > 10.96.0.10.domain: 10261+ A? google.com.svc.cluster.local. (46)
11:51:00.554004 ?     Out IP 10.10.1.6.56902 > 10.10.1.2.domain: 10261+ A? google.com.svc.cluster.local. (46)
11:51:00.554010 ?     P   IP 10.10.1.6.56902 > 10.96.0.10.domain: 10681+ AAAA? google.com.svc.cluster.local. (46)
11:51:00.554012 ?     Out IP 10.10.1.6.56902 > 10.10.1.2.domain: 10681+ AAAA? google.com.svc.cluster.local. (46)
11:51:00.554043 ?     P   IP 10.10.1.2.domain > 10.10.1.6.56902: 10681 NXDomain*- 0/1/0 (139)
11:51:00.554046 ?     Out IP 10.96.0.10.domain > 10.10.1.6.56902: 10681 NXDomain*- 0/1/0 (139)
11:51:00.554072 ?     P   IP 10.10.1.2.domain > 10.10.1.6.56902: 10261 NXDomain*- 0/1/0 (139)
11:51:00.554073 ?     Out IP 10.96.0.10.domain > 10.10.1.6.56902: 10261 NXDomain*- 0/1/0 (139)
11:51:00.554080 ?     P   IP 10.10.1.6.47659 > 10.96.0.10.domain: 44807+ A? google.com.cluster.local. (42)
11:51:00.554086 ?     Out IP 10.10.1.6.47659 > 10.10.1.2.domain: 44807+ A? google.com.cluster.local. (42)
11:51:00.554088 ?     P   IP 10.10.1.6.47659 > 10.96.0.10.domain: 45150+ AAAA? google.com.cluster.local. (42)
11:51:00.554090 ?     Out IP 10.10.1.6.47659 > 10.10.1.2.domain: 45150+ AAAA? google.com.cluster.local. (42)
11:51:00.554124 ?     P   IP 10.10.1.2.domain > 10.10.1.6.47659: 44807 NXDomain*- 0/1/0 (135)
11:51:00.554126 ?     Out IP 10.96.0.10.domain > 10.10.1.6.47659: 44807 NXDomain*- 0/1/0 (135)
11:51:00.554148 ?     P   IP 10.10.1.2.domain > 10.10.1.6.47659: 45150 NXDomain*- 0/1/0 (135)
11:51:00.554155 ?     Out IP 10.96.0.10.domain > 10.10.1.6.47659: 45150 NXDomain*- 0/1/0 (135)
11:51:00.554191 ?     P   IP 10.10.1.6.41581 > 10.96.0.10.domain: 11290+ A? google.com. (28)
11:51:00.554209 ?     Out IP 10.10.1.6.41581 > 10.10.1.3.domain: 11290+ A? google.com. (28)
11:51:00.554221 ?     P   IP 10.10.1.6.41581 > 10.96.0.10.domain: 11688+ AAAA? google.com. (28)
11:51:00.554226 ?     Out IP 10.10.1.6.41581 > 10.10.1.3.domain: 11688+ AAAA? google.com. (28)
11:51:00.554307 ?     P   IP 10.10.1.3.domain > 10.10.1.6.41581: 11290* 1/0/0 A 142.251.221.206 (54)
11:51:00.554310 ?     Out IP 10.96.0.10.domain > 10.10.1.6.41581: 11290* 1/0/0 A 142.251.221.206 (54)
11:51:00.554323 ?     P   IP 10.10.1.3.domain > 10.10.1.6.41581: 11688* 1/0/0 AAAA 2404:6800:4007:837::200e (66)
11:51:00.554324 ?     Out IP 10.96.0.10.domain > 10.10.1.6.41581: 11688* 1/0/0 AAAA 2404:6800:4007:837::200e (66)
11:51:00.554380 ?     P   IP 10.10.1.6 > pnmaaa-ba-in-f14.1e100.net: ICMP echo request, id 1276, seq 0, length 64
11:51:00.554392 br-5579defd698e In  IP 10.10.1.6 > pnmaaa-ba-in-f14.1e100.net: ICMP echo request, id 1276, seq 0, length 64
11:51:00.618796 br-5579defd698e Out IP pnmaaa-ba-in-f14.1e100.net > 10.10.1.6: ICMP echo reply, id 1276, seq 0, length 64
11:51:00.618810 ?     Out IP pnmaaa-ba-in-f14.1e100.net > 10.10.1.6: ICMP echo reply, id 1276, seq 0, length 64
11:51:02.620734 ?     P   IP 10.10.1.6.55696 > 10.96.0.10.domain: 26068+ A? google.com.kube-system.svc.cluster.local. (58)
11:51:02.620765 ?     Out IP 10.10.1.6.55696 > 10.10.1.3.domain: 26068+ A? google.com.kube-system.svc.cluster.local. (58)
11:51:02.620779 ?     P   IP 10.10.1.6.55696 > 10.96.0.10.domain: 26374+ AAAA? google.com.kube-system.svc.cluster.local. (58)
11:51:02.620783 ?     Out IP 10.10.1.6.55696 > 10.10.1.3.domain: 26374+ AAAA? google.com.kube-system.svc.cluster.local. (58)
11:51:02.620956 ?     P   IP 10.10.1.3.domain > 10.10.1.6.55696: 26068 NXDomain*- 0/1/0 (151)
11:51:02.620963 ?     Out IP 10.96.0.10.domain > 10.10.1.6.55696: 26068 NXDomain*- 0/1/0 (151)
11:51:02.620990 ?     P   IP 10.10.1.3.domain > 10.10.1.6.55696: 26374 NXDomain*- 0/1/0 (151)
11:51:02.620994 ?     Out IP 10.96.0.10.domain > 10.10.1.6.55696: 26374 NXDomain*- 0/1/0 (151)
11:51:02.621016 ?     P   IP 10.10.1.6.57827 > 10.96.0.10.domain: 63163+ A? google.com.svc.cluster.local. (46)
11:51:02.621030 ?     Out IP 10.10.1.6.57827 > 10.10.1.3.domain: 63163+ A? google.com.svc.cluster.local. (46)
11:51:02.621035 ?     P   IP 10.10.1.6.57827 > 10.96.0.10.domain: 63306+ AAAA? google.com.svc.cluster.local. (46)
11:51:02.621038 ?     Out IP 10.10.1.6.57827 > 10.10.1.3.domain: 63306+ AAAA? google.com.svc.cluster.local. (46)
11:51:02.621109 ?     P   IP 10.10.1.3.domain > 10.10.1.6.57827: 63306 NXDomain*- 0/1/0 (139)
11:51:02.621116 ?     Out IP 10.96.0.10.domain > 10.10.1.6.57827: 63306 NXDomain*- 0/1/0 (139)
11:51:02.621136 ?     P   IP 10.10.1.3.domain > 10.10.1.6.57827: 63163 NXDomain*- 0/1/0 (139)
11:51:02.621139 ?     Out IP 10.96.0.10.domain > 10.10.1.6.57827: 63163 NXDomain*- 0/1/0 (139)
11:51:02.621153 ?     P   IP 10.10.1.6.51854 > 10.96.0.10.domain: 6751+ A? google.com.cluster.local. (42)
11:51:02.621164 ?     Out IP 10.10.1.6.51854 > 10.10.1.3.domain: 6751+ A? google.com.cluster.local. (42)
11:51:02.621168 ?     P   IP 10.10.1.6.51854 > 10.96.0.10.domain: 7119+ AAAA? google.com.cluster.local. (42)
11:51:02.621171 ?     Out IP 10.10.1.6.51854 > 10.10.1.3.domain: 7119+ AAAA? google.com.cluster.local. (42)
11:51:02.621231 ?     P   IP 10.10.1.3.domain > 10.10.1.6.51854: 7119 NXDomain*- 0/1/0 (135)
11:51:02.621238 ?     Out IP 10.96.0.10.domain > 10.10.1.6.51854: 7119 NXDomain*- 0/1/0 (135)
11:51:02.621256 ?     P   IP 10.10.1.3.domain > 10.10.1.6.51854: 6751 NXDomain*- 0/1/0 (135)
11:51:02.621258 ?     Out IP 10.96.0.10.domain > 10.10.1.6.51854: 6751 NXDomain*- 0/1/0 (135)
11:51:02.621272 ?     P   IP 10.10.1.6.47779 > 10.96.0.10.domain: 60379+ A? google.com. (28)
11:51:02.621288 ?     P   IP 10.10.1.6.47779 > 10.96.0.10.domain: 60489+ AAAA? google.com. (28)
11:51:02.621389 ?     Out IP 10.10.1.6.47779 > 10.10.1.3.domain: 60379+ A? google.com. (28)
11:51:02.621400 ?     Out IP 10.10.1.6.47779 > 10.10.1.3.domain: 60489+ AAAA? google.com. (28)
11:51:02.621484 ?     P   IP 10.10.1.3.domain > 10.10.1.6.47779: 60489* 1/0/0 AAAA 2404:6800:4007:837::200e (66)
11:51:02.621492 ?     Out IP 10.96.0.10.domain > 10.10.1.6.47779: 60489* 1/0/0 AAAA 2404:6800:4007:837::200e (66)
11:51:02.621549 ?     P   IP 10.10.1.3.domain > 10.10.1.6.47779: 60379* 1/0/0 A 142.251.221.206 (54)
11:51:02.621559 ?     Out IP 10.96.0.10.domain > 10.10.1.6.47779: 60379* 1/0/0 A 142.251.221.206 (54)
11:51:02.621625 ?     P   IP 10.10.1.6 > pnmaaa-ba-in-f14.1e100.net: ICMP echo request, id 1278, seq 0, length 64
11:51:02.621636 br-5579defd698e In  IP 10.10.1.6 > pnmaaa-ba-in-f14.1e100.net: ICMP echo request, id 1278, seq 0, length 64
11:51:02.684844 br-5579defd698e Out IP pnmaaa-ba-in-f14.1e100.net > 10.10.1.6: ICMP echo reply, id 1278, seq 0, length 64
11:51:02.684850 ?     Out IP pnmaaa-ba-in-f14.1e100.net > 10.10.1.6: ICMP echo reply, id 1278, seq 0, length 64
11:51:04.686200 ?     P   IP 10.10.1.6.58983 > 10.96.0.10.domain: 17054+ A? google.com.kube-system.svc.cluster.local. (58)
11:51:04.686234 ?     P   IP 10.10.1.6.58983 > 10.96.0.10.domain: 17338+ AAAA? google.com.kube-system.svc.cluster.local. (58)
11:51:04.686373 ?     Out IP 10.10.1.6.58983 > 10.10.1.3.domain: 17054+ A? google.com.kube-system.svc.cluster.local. (58)
11:51:04.686391 ?     Out IP 10.10.1.6.58983 > 10.10.1.3.domain: 17338+ AAAA? google.com.kube-system.svc.cluster.local. (58)
11:51:04.686589 ?     P   IP 10.10.1.3.domain > 10.10.1.6.58983: 17338 NXDomain*- 0/1/0 (151)
11:51:04.686599 ?     Out IP 10.96.0.10.domain > 10.10.1.6.58983: 17338 NXDomain*- 0/1/0 (151)
11:51:04.686629 ?     P   IP 10.10.1.3.domain > 10.10.1.6.58983: 17054 NXDomain*- 0/1/0 (151)
11:51:04.686632 ?     Out IP 10.96.0.10.domain > 10.10.1.6.58983: 17054 NXDomain*- 0/1/0 (151)
11:51:04.686665 ?     P   IP 10.10.1.6.55135 > 10.96.0.10.domain: 36213+ A? google.com.svc.cluster.local. (46)
11:51:04.686683 ?     P   IP 10.10.1.6.55135 > 10.96.0.10.domain: 36368+ AAAA? google.com.svc.cluster.local. (46)
11:51:04.686857 ?     Out IP 10.10.1.6.55135 > 10.10.1.2.domain: 36213+ A? google.com.svc.cluster.local. (46)
11:51:04.686871 ?     Out IP 10.10.1.6.55135 > 10.10.1.2.domain: 36368+ AAAA? google.com.svc.cluster.local. (46)
11:51:04.687011 ?     P   IP 10.10.1.2.domain > 10.10.1.6.55135: 36368 NXDomain*- 0/1/0 (139)
11:51:04.687017 ?     Out IP 10.96.0.10.domain > 10.10.1.6.55135: 36368 NXDomain*- 0/1/0 (139)
11:51:04.687036 ?     P   IP 10.10.1.2.domain > 10.10.1.6.55135: 36213 NXDomain*- 0/1/0 (139)
11:51:04.687037 ?     Out IP 10.96.0.10.domain > 10.10.1.6.55135: 36213 NXDomain*- 0/1/0 (139)
11:51:04.687062 ?     P   IP 10.10.1.6.43136 > 10.96.0.10.domain: 46248+ A? google.com.cluster.local. (42)
11:51:04.687072 ?     Out IP 10.10.1.6.43136 > 10.10.1.2.domain: 46248+ A? google.com.cluster.local. (42)
11:51:04.687079 ?     P   IP 10.10.1.6.43136 > 10.96.0.10.domain: 46363+ AAAA? google.com.cluster.local. (42)
11:51:04.687081 ?     Out IP 10.10.1.6.43136 > 10.10.1.2.domain: 46363+ AAAA? google.com.cluster.local. (42)
11:51:04.687110 ?     P   IP 10.10.1.2.domain > 10.10.1.6.43136: 46363 NXDomain*- 0/1/0 (135)
11:51:04.687113 ?     Out IP 10.96.0.10.domain > 10.10.1.6.43136: 46363 NXDomain*- 0/1/0 (135)
11:51:04.687136 ?     P   IP 10.10.1.2.domain > 10.10.1.6.43136: 46248 NXDomain*- 0/1/0 (135)
11:51:04.687142 ?     Out IP 10.96.0.10.domain > 10.10.1.6.43136: 46248 NXDomain*- 0/1/0 (135)
11:51:04.687185 ?     P   IP 10.10.1.6.44585 > 10.96.0.10.domain: 37797+ A? google.com. (28)
11:51:04.687197 ?     P   IP 10.10.1.6.44585 > 10.96.0.10.domain: 37927+ AAAA? google.com. (28)
11:51:04.687248 ?     Out IP 10.10.1.6.44585 > 10.10.1.3.domain: 37797+ A? google.com. (28)
11:51:04.687256 ?     Out IP 10.10.1.6.44585 > 10.10.1.3.domain: 37927+ AAAA? google.com. (28)
11:51:04.687297 ?     P   IP 10.10.1.3.domain > 10.10.1.6.44585: 37927* 1/0/0 AAAA 2404:6800:4007:837::200e (66)
11:51:04.687300 ?     Out IP 10.96.0.10.domain > 10.10.1.6.44585: 37927* 1/0/0 AAAA 2404:6800:4007:837::200e (66)
11:51:04.687312 ?     P   IP 10.10.1.3.domain > 10.10.1.6.44585: 37797* 1/0/0 A 142.251.221.206 (54)
11:51:04.687313 ?     Out IP 10.96.0.10.domain > 10.10.1.6.44585: 37797* 1/0/0 A 142.251.221.206 (54)
11:51:04.687378 ?     P   IP 10.10.1.6 > pnmaaa-ba-in-f14.1e100.net: ICMP echo request, id 1280, seq 0, length 64
11:51:04.687394 br-5579defd698e In  IP 10.10.1.6 > pnmaaa-ba-in-f14.1e100.net: ICMP echo request, id 1280, seq 0, length 64
11:51:04.749104 br-5579defd698e Out IP pnmaaa-ba-in-f14.1e100.net > 10.10.1.6: ICMP echo reply, id 1280, seq 0, length 64
11:51:04.749117 ?     Out IP pnmaaa-ba-in-f14.1e100.net > 10.10.1.6: ICMP echo reply, id 1280, seq 0, length 64
11:51:05.914531 ?     P   ARP, Request who-has 10.10.1.6 tell 10.10.1.2, length 28
11:51:05.914691 ?     Out ARP, Request who-has 10.10.1.6 tell 10.10.1.2, length 28
11:51:05.914699 ?     P   ARP, Reply 10.10.1.6 is-at d6:27:0c:35:b1:16 (oui Unknown), length 28
11:51:05.914747 ?     Out ARP, Reply 10.10.1.6 is-at d6:27:0c:35:b1:16 (oui Unknown), length 28
11:51:06.750561 ?     P   IP 10.10.1.6.34113 > 10.96.0.10.domain: 20843+ A? google.com.kube-system.svc.cluster.local. (58)
11:51:06.750594 ?     P   IP 10.10.1.6.34113 > 10.96.0.10.domain: 21109+ AAAA? google.com.kube-system.svc.cluster.local. (58)
11:51:06.750749 ?     Out IP 10.10.1.6.34113 > 10.10.1.3.domain: 20843+ A? google.com.kube-system.svc.cluster.local. (58)
11:51:06.750767 ?     Out IP 10.10.1.6.34113 > 10.10.1.3.domain: 21109+ AAAA? google.com.kube-system.svc.cluster.local. (58)
11:51:06.750945 ?     P   IP 10.10.1.3.domain > 10.10.1.6.34113: 20843 NXDomain*- 0/1/0 (151)
11:51:06.750956 ?     Out IP 10.96.0.10.domain > 10.10.1.6.34113: 20843 NXDomain*- 0/1/0 (151)
11:51:06.750981 ?     P   IP 10.10.1.3.domain > 10.10.1.6.34113: 21109 NXDomain*- 0/1/0 (151)
11:51:06.750983 ?     Out IP 10.96.0.10.domain > 10.10.1.6.34113: 21109 NXDomain*- 0/1/0 (151)
11:51:06.751031 ?     P   IP 10.10.1.6.42398 > 10.96.0.10.domain: 52389+ A? google.com.svc.cluster.local. (46)
11:51:06.751047 ?     P   IP 10.10.1.6.42398 > 10.96.0.10.domain: 52616+ AAAA? google.com.svc.cluster.local. (46)
11:51:06.751114 ?     Out IP 10.10.1.6.42398 > 10.10.1.2.domain: 52389+ A? google.com.svc.cluster.local. (46)
